name,z,lat,lon,cortarNo
포항시,,,,
포항시 남구,,,,
포항시 남구 상도동,14,36.0116,129.3519,4711110100
포항시 남구 대도동,14,36.0159,129.3635,4711110200
포항시 남구 해도동,14,36.02,129.3713,4711110300
포항시 남구 송도동,14,36.031907,129.375474,4711110400
포항시 남구 청림동,14,35.997512,129.406435,4711110500
포항시 남구 일월동,14,35.9892,129.4222,4711110600
포항시 남구 송정동,14,36.0261,129.3944,4711110700
포항시 남구 송내동,14,36.0089,129.3843,4711110800
포항시 남구 괴동동,14,35.997251,129.374413,4711110900
포항시 남구 동촌동,14,36.002307,129.395926,4711111000
포항시 남구 장흥동,14,35.9799,129.3725,4711111100
포항시 남구 인덕동,14,35.987185,129.3975,4711111200
포항시 남구 호동,14,35.9821,129.3867,4711111300
포항시 남구 효자동,14,36.0082,129.3316,4711111400
포항시 남구 지곡동,14,36.0244,129.320775,4711111500
포항시 남구 대잠동,14,36.018075,129.339563,4711111600
포항시 남구 이동,14,36.033,129.334,4711111700
포항시 남구 구룡포읍,14,35.985108,129.546022,4711125000
포항시 남구 구룡포읍 구룡포리,,,,
포항시 남구 구룡포읍 삼정리,,,,
포항시 남구 구룡포읍 석병리,,,,
포항시 남구 구룡포읍 성동리,,,,
포항시 남구 구룡포읍 구평리,,,,
포항시 남구 구룡포읍 장길리,,,,
포항시 남구 구룡포읍 하정리,,,,
포항시 남구 구룡포읍 병포리,,,,
포항시 남구 구룡포읍 후동리,,,,
포항시 남구 구룡포읍 눌태리,,,,
포항시 남구 연일읍,14,35.991618,129.3441,4711125300
포항시 남구 연일읍 생지리,,,,
포항시 남구 연일읍 괴정리,,,,
포항시 남구 연일읍 동문리,,,,
포항시 남구 연일읍 오천리,,,,
포항시 남구 연일읍 유강리,,,,
포항시 남구 연일읍 자명리,,,,
포항시 남구 연일읍 학전리,,,,
포항시 남구 연일읍 달전리,,,,
포항시 남구 연일읍 중명리,,,,
포항시 남구 연일읍 중단리,,,,
포항시 남구 연일읍 택전리,,,,
포항시 남구 연일읍 인주리,,,,
포항시 남구 연일읍 우복리,,,,
포항시 남구 오천읍,14,35.963167,129.41466,4711125600
포항시 남구 오천읍 원리,,,,
포항시 남구 오천읍 문덕리,,,,
포항시 남구 오천읍 항사리,,,,
포항시 남구 오천읍 진전리,,,,
포항시 남구 오천읍 갈평리,,,,
포항시 남구 오천읍 문충리,,,,
포항시 남구 오천읍 용산리,,,,
포항시 남구 오천읍 광명리,,,,
포항시 남구 오천읍 세계리,,,,
포항시 남구 오천읍 용덕리,,,,
포항시 남구 오천읍 구정리,,,,
포항시 남구 대송면,14,35.968501,129.359925,4711131000
포항시 남구 대송면 공수리,,,,
포항시 남구 대송면 장동리,,,,
포항시 남구 대송면 홍계리,,,,
포항시 남구 대송면 산여리,,,,
포항시 남구 대송면 대각리,,,,
포항시 남구 대송면 송동리,,,,
포항시 남구 대송면 제내리,,,,
포항시 남구 대송면 옥명리,,,,
포항시 남구 대송면 남성리,,,,
포항시 남구 동해면,14,35.988473,129.440169,4711132000
포항시 남구 동해면 도구리,,,,
포항시 남구 동해면 약전리,,,,
포항시 남구 동해면 금광리,,,,
포항시 남구 동해면 신정리,,,,
포항시 남구 동해면 석리,,,,
포항시 남구 동해면 임곡리,,,,
포항시 남구 동해면 입암리,,,,
포항시 남구 동해면 마산리,,,,
포항시 남구 동해면 흥환리,,,,
포항시 남구 동해면 중흥리,,,,
포항시 남구 동해면 발산리,,,,
포항시 남구 동해면 상정리,,,,
포항시 남구 동해면 중산리,,,,
포항시 남구 동해면 공당리,,,,
포항시 남구 장기면,14,35.895757,129.492237,4711133000
포항시 남구 장기면 읍내리,,,,
포항시 남구 장기면 마현리,,,,
포항시 남구 장기면 금곡리,,,,
포항시 남구 장기면 영암리,,,,
포항시 남구 장기면 신창리,,,,
포항시 남구 장기면 양포리,,,,
포항시 남구 장기면 계원리,,,,
포항시 남구 장기면 두원리,,,,
포항시 남구 장기면 수성리,,,,
포항시 남구 장기면 임중리,,,,
포항시 남구 장기면 방산리,,,,
포항시 남구 장기면 산서리,,,,
포항시 남구 장기면 서촌리,,,,
포항시 남구 장기면 금오리,,,,
포항시 남구 장기면 대진리,,,,
포항시 남구 장기면 모포리,,,,
포항시 남구 장기면 학계리,,,,
포항시 남구 장기면 학곡리,,,,
포항시 남구 장기면 신계리,,,,
포항시 남구 장기면 창지리,,,,
포항시 남구 장기면 대곡리,,,,
포항시 남구 장기면 죽정리,,,,
포항시 남구 장기면 정천리,,,,
포항시 남구 호미곶면,14,36.080854,129.555531,4711135000
포항시 남구 호미곶면 강사리,,,,
포항시 남구 호미곶면 대보리,,,,
포항시 남구 호미곶면 구만리,,,,
포항시 남구 호미곶면 대동배리,,,,
포항시 북구,,,,
포항시 북구 대흥동,14,36.036608,129.3613,4711310100
포항시 북구 신흥동,14,36.04,129.3627,4711310200
포항시 북구 남빈동,14,36.036377,129.365919,4711310300
포항시 북구 상원동,14,36.038732,129.365774,4711310400
포항시 북구 여천동,14,36.0398,129.3681,4711310500
포항시 북구 중앙동,14,36.039767,129.363975,4711310600
포항시 북구 덕산동,14,36.042,129.3657,4711310700
포항시 북구 덕수동,14,36.045583,129.3642,4711310800
포항시 북구 대신동,14,36.0475,129.3671,4711310900
포항시 북구 동빈1가,14,36.0453,129.3701,4711311000
포항시 북구 동빈2가,14,36.0411,129.3697,4711311100
포항시 북구 학산동,14,36.049396,129.368524,4711311200
포항시 북구 항구동,14,36.0537,129.3754,4711311300
포항시 북구 득량동,14,36.0307,129.3424,4711311400
포항시 북구 학잠동,14,36.035454,129.34227,4711311500
포항시 북구 죽도동,14,36.0255,129.3582,4711311600
포항시 북구 용흥동,14,36.038331,129.357663,4711311700
포항시 북구 우현동,14,36.059,129.355,4711311800
포항시 북구 창포동,14,36.07,129.3597,4711311900
포항시 북구 두호동,14,36.06092,129.380073,4711312000
포항시 북구 장성동,14,36.0762,129.3787,4711312100
포항시 북구 양덕동,14,36.0725,129.388,4711312200
포항시 북구 환호동,14,36.0702,129.3958,4711312300
포항시 북구 여남동,14,36.077,129.4107,4711312400
포항시 북구 흥해읍,14,36.107199,129.341663,4711325000
포항시 북구 흥해읍 매산리,,,,
포항시 북구 흥해읍 북송리,,,,
포항시 북구 흥해읍 마산리,,,,
포항시 북구 흥해읍 옥성리,,,,
포항시 북구 흥해읍 약성리,,,,
포항시 북구 흥해읍 학성리,,,,
포항시 북구 흥해읍 남성리,,,,
포항시 북구 흥해읍 성내리,,,,
포항시 북구 흥해읍 중성리,,,,
포항시 북구 흥해읍 망천리,,,,
포항시 북구 흥해읍 남송리,,,,
포항시 북구 흥해읍 곡강리,,,,
포항시 북구 흥해읍 용한리,,,,
포항시 북구 흥해읍 우목리,,,,
포항시 북구 흥해읍 죽천리,,,,
포항시 북구 흥해읍 용곡리,,,,
포항시 북구 흥해읍 양백리,,,,
포항시 북구 흥해읍 덕성리,,,,
포항시 북구 흥해읍 덕장리,,,,
포항시 북구 흥해읍 용전리,,,,
포항시 북구 흥해읍 용천리,,,,
포항시 북구 흥해읍 금장리,,,,
포항시 북구 흥해읍 흥안리,,,,
포항시 북구 흥해읍 칠포리,,,,
포항시 북구 흥해읍 오도리,,,,
포항시 북구 흥해읍 초곡리,,,,
포항시 북구 흥해읍 학천리,,,,
포항시 북구 흥해읍 성곡리,,,,
포항시 북구 흥해읍 이인리,,,,
포항시 북구 흥해읍 대련리,,,,
포항시 북구 신광면,14,36.130136,129.262907,4711331000
포항시 북구 신광면 냉수리,,,,
포항시 북구 신광면 흥곡리,,,,
포항시 북구 신광면 우각리,,,,
포항시 북구 신광면 죽성리,,,,
포항시 북구 신광면 상읍리,,,,
포항시 북구 신광면 토성리,,,,
포항시 북구 신광면 사정리,,,,
포항시 북구 신광면 안덕리,,,,
포항시 북구 신광면 만석리,,,,
포항시 북구 신광면 반곡리,,,,
포항시 북구 신광면 기일리,,,,
포항시 북구 신광면 마북리,,,,
포항시 북구 신광면 호리,,,,
포항시 북구 청하면,14,36.19956,129.337912,4711332000
포항시 북구 청하면 덕성리,,,,
포항시 북구 청하면 덕천리,,,,
포항시 북구 청하면 미남리,,,,
포항시 북구 청하면 필화리,,,,
포항시 북구 청하면 용두리,,,,
포항시 북구 청하면 월포리,,,,
포항시 북구 청하면 방어리,,,,
포항시 북구 청하면 이가리,,,,
포항시 북구 청하면 청진리,,,,
포항시 북구 청하면 신흥리,,,,
포항시 북구 청하면 소동리,,,,
포항시 북구 청하면 고현리,,,,
포항시 북구 청하면 하대리,,,,
포항시 북구 청하면 상대리,,,,
포항시 북구 청하면 서정리,,,,
포항시 북구 청하면 명안리,,,,
포항시 북구 청하면 유계리,,,,
포항시 북구 청하면 청계리,,,,
포항시 북구 송라면,14,36.228834,129.356945,4711333000
포항시 북구 송라면 상송리,,,,
포항시 북구 송라면 하송리,,,,
포항시 북구 송라면 중산리,,,,
포항시 북구 송라면 광천리,,,,
포항시 북구 송라면 조사리,,,,
포항시 북구 송라면 방석리,,,,
포항시 북구 송라면 화진리,,,,
포항시 북구 송라면 대전리,,,,
포항시 북구 송라면 지경리,,,,
포항시 북구 기계면,14,36.072433,129.21025,4711334000
포항시 북구 기계면 현내리,,,,
포항시 북구 기계면 지가리,,,,
포항시 북구 기계면 봉계리,,,,
포항시 북구 기계면 고지리,,,,
포항시 북구 기계면 문성리,,,,
포항시 북구 기계면 학야리,,,,
포항시 북구 기계면 성계리,,,,
포항시 북구 기계면 내단리,,,,
포항시 북구 기계면 화대리,,,,
포항시 북구 기계면 화봉리,,,,
포항시 북구 기계면 계전리,,,,
포항시 북구 기계면 미현리,,,,
포항시 북구 기계면 인비리,,,,
포항시 북구 기계면 구지리,,,,
포항시 북구 기계면 가안리,,,,
포항시 북구 기계면 남계리,,,,
포항시 북구 죽장면,14,36.160182,129.095775,4711335000
포항시 북구 죽장면 가사리,,,,
포항시 북구 죽장면 매현리,,,,
포항시 북구 죽장면 침곡리,,,,
포항시 북구 죽장면 입암리,,,,
포항시 북구 죽장면 일광리,,,,
포항시 북구 죽장면 지동리,,,,
포항시 북구 죽장면 정자리,,,,
포항시 북구 죽장면 감곡리,,,,
포항시 북구 죽장면 상사리,,,,
포항시 북구 죽장면 하사리,,,,
포항시 북구 죽장면 석계리,,,,
포항시 북구 죽장면 합덕리,,,,
포항시 북구 죽장면 월평리,,,,
포항시 북구 죽장면 방흥리,,,,
포항시 북구 죽장면 현내리,,,,
포항시 북구 죽장면 봉계리,,,,
포항시 북구 죽장면 두마리,,,,
포항시 북구 죽장면 상옥리,,,,
포항시 북구 죽장면 하옥리,,,,
포항시 북구 기북면,14,36.128582,129.16635,4711336000
포항시 북구 기북면 관천리,,,,
포항시 북구 기북면 대곡리,,,,
포항시 북구 기북면 율산리,,,,
포항시 북구 기북면 용기리,,,,
포항시 북구 기북면 오덕리,,,,
포항시 북구 기북면 탑정리,,,,
포항시 북구 기북면 성법리,,,,
